slug,title,category,intro,section1_title,section1_items,section2_title,section2_items
car-maintenance-checklist,Car Maintenance Checklist,car,Regular maintenance keeps your vehicle running smoothly.,Maintenance Tasks,oil change | tire pressure,Checks,brake inspection
car-roadtrip-checklist,Car Road Trip Checklist,car,Road trips require a well-prepared vehicle.,Vehicle Prep,check fluids | tire pressure,Travel Items,phone charger | snacks
first-time-driver-checklist,First Time Driver Checklist,car,New drivers benefit from preparation.,Driving Basics,seat adjustment | mirrors,Safety Items,license | insurance
moving-utility-cancel-checklist,Utility Cancellation Checklist,moving,Canceling utilities prevents extra bills.,Utilities,electric | water | internet,Steps,confirm shutoff dates
packing-fragile-items-checklist,Packing Fragile Items Checklist,moving,Fragile items require careful packing.,Packing Supplies,bubble wrap | boxes,Steps,label fragile
storage-unit-checklist,Storage Unit Checklist,moving,Storage units help during moves.,Before Storage,clean items | label boxes,During Storage,stack safely
apartment-lease-signing-checklist,Lease Signing Checklist,moving,Signing a lease requires attention to detail.,Review Terms,rent amount | rules,Bring Documents,ID | payment method
new-neighborhood-checklist,New Neighborhood Setup Checklist,moving,Settling into a new area is easier with preparation.,Local Setup,find grocery store | pharmacy,Community,meet neighbors
bridal-shower-checklist,Bridal Shower Checklist,events,Bridal showers require planning.,Preparation,guest list | decorations,Party Items,gifts | cake
wedding-rehearsal-checklist,Wedding Rehearsal Checklist,events,Rehearsals ensure wedding day runs smoothly.,Preparation,confirm schedule | coordinate party,Bring Items,rings | vows
bachelor-party-checklist,Bachelor Party Checklist,events,Bachelor parties require organization.,Planning Steps,choose location | set budget,Party Items,decorations | drinks
bachelorette-party-checklist,Bachelorette Party Checklist,events,Bachelorette parties require preparation.,Planning Steps,choose activities | invite guests,Party Supplies,decorations | snacks
engagement-checklist,Engagement Planning Checklist,events,Engagement celebrations require preparation.,Planning Steps,announce engagement,Party Items,decorations | invitations
proposal-planning-checklist,Proposal Planning Checklist,events,Planning a proposal requires attention to detail.,Preparation,choose location | ring purchase,Execution,photographer | speech
baby-arrival-checklist,Baby Arrival Checklist,baby,Preparing for a newborn requires organization.,Baby Essentials,diapers | wipes,Nursery,crib | monitor
toddler-safety-checklist,Toddler Safety Checklist,baby,Toddler safety requires preparation.,Safety Steps,install gates,Childproofing,outlet covers
daycare-prep-checklist,Daycare Preparation Checklist,baby,Daycare starts are easier with preparation.,Bring Items,diapers | extra clothes,Info Items,emergency contacts
baby-travel-checklist,Baby Travel Checklist,baby,Traveling with a baby requires planning.,Baby Essentials,diapers | wipes,Travel Items,stroller | carrier
new-parent-checklist,New Parent Checklist,baby,Becoming a parent requires preparation.,Baby Care,feeding supplies | diapers,Parent Prep,rest schedule
