slug,title,category,intro,section1_title,section1_items,section2_title,section2_items
marathon-training-checklist,Marathon Training Checklist,fitness,Training for a marathon requires preparation.,Training Gear,running shoes | watch,Nutrition Items,energy gels | hydration
cycling-gear-checklist,Cycling Gear Checklist,fitness,Cyclists need proper equipment for safety.,Bike Gear,helmet | gloves,Safety Items,lights | repair kit
carry-on-only-checklist,Carry On Only Packing Checklist,travel,Packing carry on only is easier with a plan. This checklist keeps your bag light and complete.,Carry On Essentials,passport | wallet | phone charger | headphones | medications,Clothing Basics,underwear | socks | t shirts | lightweight jacket
week-long-trip-checklist,Week Long Trip Packing Checklist,travel,Packing for a week is easier with a checklist. This list covers essentials for most trips.,Clothes,shirts | pants | underwear | socks | pajamas,Travel Items,toiletries | phone charger | laundry bag | travel pillow
camping-food-checklist,Camping Food Checklist,travel,Camping meals are easier when planned. This checklist helps you pack food and cooking basics.,Food Basics,breakfast items | lunch items | dinner items | snacks | drinks,Cooking Items,cooler | ice | camp stove fuel | cookware | utensils
camping-safety-checklist,Camping Safety Checklist,travel,Camping is safer when you plan ahead. This checklist covers safety essentials.,Safety Gear,first aid kit | flashlight | extra batteries | whistle | map,Weather Prep,rain jacket | warm layers | sunscreen | bug spray
national-park-checklist,National Park Trip Checklist,travel,National park trips are better with preparation. This checklist covers essentials for a great day.,Essentials,park pass | water | snacks | map | sunscreen,Hiking Extras,daypack | hat | binoculars | camera
airbnb-stay-checklist,Airbnb Stay Checklist,travel,A short checklist helps you remember essentials for an Airbnb stay. It also helps at checkout.,Before Arrival,confirm address | check in instructions | parking info,Checkout Tasks,trash out | dishes done | lock doors
campus-move-in-checklist,Campus Move In Checklist,college,Campus move in day can be hectic. This checklist helps you arrive prepared.,Bring With You,ID | dorm key info | bedding | toiletries,Move In Helpers,tool kit | labels | snacks | water
class-registration-checklist,Class Registration Checklist,college,Registering for classes is easier with a plan. This checklist keeps you organized.,Before Registration,check degree plan | list needed classes | check holds,During Registration,select sections | confirm schedule | save screenshots
study-abroad-checklist,Study Abroad Checklist,college,Study abroad requires planning and paperwork. This checklist covers the basics.,Documents,passport | visa | school forms | insurance,Travel Prep,adapter | copies of documents | emergency contacts
college-financial-aid-checklist,College Financial Aid Checklist,college,Financial aid has deadlines and steps. This checklist helps you stay on track.,Key Tasks,fill FAFSA | check deadlines | submit documents,Helpful Steps,create budget | track emails | save award letter
internship-prep-checklist,Internship Preparation Checklist,career,Internships are easier when you prepare early. This checklist helps you get ready.,Before Starting,confirm schedule | dress code | paperwork,First Week,meet supervisor | set goals | take notes
two-weeks-notice-checklist,Two Weeks Notice Checklist,career,Leaving a job professionally matters. This checklist helps you resign the right way.,Before You Resign,write letter | plan last day | save contacts,After Notice,document work | train replacement | return equipment
work-trip-checklist,Work Trip Packing Checklist,career,Work travel is smoother when prepared. This checklist covers business trip essentials.,Work Essentials,laptop | charger | notebook | business cards,Travel Essentials,toiletries | casual clothes | headphones
performance-review-checklist,Performance Review Checklist,career,Performance reviews go better with preparation. This checklist helps you get ready.,Prepare Notes,accomplishments | metrics | projects | feedback,Meeting Prep,goals | questions | next steps
kitchen-stockup-checklist,Kitchen Stock Up Checklist,home,Stocking a kitchen is easier when organized. This checklist covers core cooking needs.,Cooking Basics,salt | pepper | oil | rice | pasta,Kitchen Tools,cutting board | knife | spatula | measuring cups
pantry-staples-checklist,Pantry Staples Checklist,home,Pantry staples make meals easier. This checklist helps you stock the basics.,Staples,rice | pasta | canned tomatoes | beans | oats,Seasonings,salt | pepper | garlic powder | chili powder | italian seasoning
home-inventory-checklist,Home Inventory Checklist,home,A home inventory helps with insurance and organization. This checklist helps you document items.,Record Items,photos | serial numbers | receipts,Store Safely,cloud backup | printed copy | safe location
renter-setup-checklist,Renter Move In Setup Checklist,home,Renters have specific setup tasks after moving in. This checklist helps you get settled fast.,First Day Tasks,check locks | test smoke alarms | locate shutoff valves,Setup Tasks,set utilities | internet setup | trash schedule
apartment-utilities-checklist,Utilities Setup Checklist,moving,Utilities can take time to activate. This checklist helps you set them up before move in.,Utilities,electric | water | gas | internet,Account Tasks,confirm start dates | autopay setup | save account numbers
deep-freezer-checklist,Deep Freezer Organization Checklist,home,A deep freezer saves money when organized. This checklist helps you label and store food.,Organize Steps,label bags | date items | group categories,Maintenance,defrost freezer | wipe shelves | update list
pet-sitting-checklist,Pet Sitting Checklist,pets,Pet sitting is easier with a plan. This checklist helps you care for a pet safely.,Daily Care,food | water | walk schedule | litter box,Important Info,veterinarian contact | meds instructions | emergency numbers
dog-grooming-at-home-checklist,Dog Grooming At Home Checklist,pets,Home grooming saves time. This checklist covers basic supplies and steps.,Supplies,brush | nail clippers | dog shampoo | towels,Grooming Steps,brush coat | trim nails | clean ears
cat-litter-setup-checklist,Cat Litter Setup Checklist,pets,A good litter setup prevents mess and stress. This checklist covers essentials.,Litter Essentials,litter box | litter | scoop | liners,Setup Tips,quiet location | mat | regular cleaning schedule
new-dog-checklist,New Dog Checklist,pets,Bringing home a dog is easier with preparation. This checklist covers the basics.,Dog Essentials,food | bowl | leash | collar | crate,Comfort Items,bed | toys | treats | blanket
pet-vet-visit-checklist,Vet Visit Checklist,pets,Vet visits go smoother when prepared. This checklist helps you bring the right info.,Bring With You,medical records | meds list | questions,Pet Items,leash | carrier | treats | towel
hurricane-evacuation-checklist,Hurricane Evacuation Checklist,emergency,Evacuation is easier when planned. This checklist helps you leave quickly and safely.,Grab First,documents | medications | phone charger | cash,Pack Next,clothes | water | snacks | pet supplies
first-aid-kit-checklist,First Aid Kit Checklist,emergency,A first aid kit helps during minor injuries. This checklist covers key supplies.,Supplies,bandages | gauze | antiseptic wipes | tape | gloves,Extras,pain reliever | tweezers | thermometer
boil-water-advisory-checklist,Boil Water Advisory Checklist,emergency,Boil water advisories require quick changes. This checklist helps you stay safe.,Water Steps,boil water | store clean water | use bottled water,Hygiene Steps,hand sanitizer | disposable plates | disinfect surfaces
car-accident-checklist,Car Accident Checklist,emergency,Car accidents are stressful. This checklist helps you handle the basics safely.,Immediate Steps,move to safe area | call police | check injuries,Documentation,photos | exchange info | insurance claim notes
school-emergency-kit-checklist,School Emergency Kit Checklist,emergency,Schools and parents benefit from a simple emergency kit. This checklist covers essentials.,Kit Items,water | snacks | flashlight | batteries,Info Items,contact list | meds list | copies of documents
running-race-day-checklist,Race Day Checklist,fitness,Race day goes better with preparation. This checklist helps you show up ready.,Race Essentials,bib | shoes | socks | water bottle,Nutrition Items,energy gel | banana | electrolyte drink
strength-training-checklist,Strength Training Checklist,fitness,Strength workouts are safer with preparation. This checklist covers basics.,Workout Essentials,warm up | proper shoes | water,Training Items,logbook | resistance bands | towel
yoga-class-checklist,Yoga Class Checklist,fitness,Yoga class is easier when prepared. This checklist covers what to bring.,Essentials,yoga mat | water bottle | towel,Optional Items,yoga blocks | strap | light snack
meal-planning-checklist,Meal Planning Checklist,home,Meal planning saves time and money. This checklist helps you plan the week.,Plan Steps,choose meals | check pantry | write grocery list,Prep Steps,prep ingredients | portion snacks | label containers
weekly-grocery-list-checklist,Weekly Grocery List Checklist,home,A weekly grocery list prevents forgotten items. This checklist covers common basics.,Fresh Items,fruit | vegetables | eggs | milk,Pantry Items,rice | pasta | canned goods | snacks
cooking-batch-prep-checklist,Batch Cooking Prep Checklist,home,Batch cooking is easier with a plan. This checklist helps you prep and store meals.,Prep Steps,choose recipes | prep containers | shop ingredients,Cook Steps,cook proteins | cook grains | portion meals
dishwasher-loading-checklist,Dishwasher Loading Checklist,home,Loading a dishwasher correctly improves cleaning. This checklist covers quick rules.,Before Loading,scrape food | check filter | run hot water,Load Tips,face dirty side inward | avoid nesting | keep spray arms clear
fridge-cleanout-checklist,Fridge Cleanout Checklist,home,Cleaning out the fridge prevents waste and smells. This checklist keeps it simple.,Clean Steps,remove food | wipe shelves | sanitize drawers,Organize Steps,date leftovers | group items | set fridge temp
moving-truck-rental-checklist,Moving Truck Rental Checklist,moving,Renting a truck is easier with a plan. This checklist helps avoid surprises.,Before Pickup,confirm reservation | check license | bring ID,At Pickup,inspect truck | take photos | confirm fuel policy
packing-essentials-bag-checklist,Packing Essentials Bag Checklist,moving,An essentials bag helps on moving day. This checklist covers what to keep with you.,Essentials,phone charger | toiletries | change of clothes | meds,Important Items,documents | keys | snacks | water
apartment-exit-cleaning-checklist,Move Out Cleaning Checklist,moving,Move out cleaning helps you get your deposit back. This checklist covers key areas.,Clean Areas,kitchen | bathroom | floors | windows,Final Steps,trash out | patch holes | take photos
college-dorm-safety-checklist,Dorm Safety Checklist,college,Dorm safety is easier when you plan ahead. This checklist covers simple steps.,Safety Items,door stop alarm | flashlight | first aid kit,Habits,lock door | save RA number | avoid candle use
note-taking-checklist,Note Taking Checklist,college,Better notes improve grades. This checklist helps you set up a simple system.,Supplies,notebook | pens | highlighter | laptop,Habits,date notes | review weekly | organize folders
group-project-checklist,Group Project Checklist,college,Group projects go smoother with structure. This checklist keeps everyone aligned.,Project Setup,choose roles | set deadlines | shared doc,Weekly Actions,check in meeting | update tasks | submit drafts
class-presentation-checklist,Class Presentation Checklist,college,Presentations go better with preparation. This checklist covers key steps.,Build Slides,outline points | add visuals | practice timing,Day Of,arrive early | bring backup | speak clearly
linkedin-profile-checklist,LinkedIn Profile Checklist,career,A strong LinkedIn profile helps job searching. This checklist covers key updates.,Profile Basics,clear photo | headline | summary,Experience,add roles | add skills | request recommendations
resume-interview-kit-checklist,Interview Kit Checklist,career,An interview kit helps you stay confident. This checklist covers what to bring.,Bring Items,resume copies | notebook | pen | ID,Optional Items,portfolio | mints | water bottle
workplace-ergonomics-checklist,Desk Ergonomics Checklist,career,Ergonomics reduces strain at work. This checklist helps set up your desk.,Desk Setup,monitor height | chair support | keyboard position,Habits,stretch breaks | eye rest | posture checks
email-inbox-cleanup-checklist,Email Inbox Cleanup Checklist,productivity,Inbox cleanup reduces stress. This checklist helps you organize email quickly.,Cleanup Steps,unsubscribe | delete junk | create folders,Habits,check set times | archive weekly | use filters
time-blocking-checklist,Time Blocking Checklist,productivity,Time blocking helps you focus. This checklist helps set up your day.,Plan Steps,list tasks | assign blocks | set breaks,Execution,turn off notifications | start timer | review end of day
weekly-reset-checklist,Weekly Reset Checklist,productivity,A weekly reset helps you start fresh. This checklist covers simple routines.,Home Reset,laundry | tidy rooms | clean kitchen,Life Reset,plan week | grocery list | check calendar
phone-cleanup-checklist,Phone Storage Cleanup Checklist,productivity,A phone cleanup improves speed and space. This checklist helps you clear clutter.,Cleanup Steps,delete unused apps | clear downloads | remove duplicates,Settings,backup photos | update iOS | enable storage tools
password-manager-setup-checklist,Password Manager Setup Checklist,productivity,A password manager improves security. This checklist helps you set it up.,Setup Steps,choose manager | set master password | import logins,Safety Steps,enable 2FA | update weak passwords | store recovery codes
starter-investing-checklist,Beginner Investing Checklist,finance,Investing is easier with a plan. This checklist covers safe first steps.,Get Ready,emergency fund | budget | debt plan,Start Investing,open account | choose index fund | automate deposits
credit-score-improvement-checklist,Credit Score Improvement Checklist,finance,Improving credit takes time and habits. This checklist covers key actions.,Core Actions,pay on time | lower utilization | avoid new debt,Monitoring,check reports | dispute errors | track score monthly
tax-season-checklist,Tax Season Checklist,finance,Tax filing is easier when organized. This checklist helps you gather what you need.,Documents,W2 | 1099 | ID | bank info,Deductions,education forms | charity receipts | mileage log
wedding-guest-checklist,Wedding Guest Checklist,events,Attending a wedding is easier when prepared. This checklist covers essentials.,Before You Go,RSVP | gift plan | confirm location,Day Of,outfit | card | directions | cash for tips
funeral-attendance-checklist,Funeral Attendance Checklist,events,Funerals are emotional and stressful. This checklist helps you prepare respectfully.,Before You Go,confirm time | dress appropriately | bring tissues,Helpful Items,card | small cash | water bottle
birthday-gift-checklist,Birthday Gift Checklist,events,Gifts are easier when planned. This checklist helps you choose and prepare.,Planning,set budget | list interests | pick gift,Finishing,take receipt | wrap gift | write card
baby-visit-checklist,Visiting New Baby Checklist,events,Visiting a newborn requires care and respect. This checklist helps you be prepared.,Before Visit,wash hands | ask permission | no strong perfume,Bring Items,simple meal | small gift | mask if sick
new-apartment-grocery-checklist,New Apartment Grocery Starter Checklist,home,First grocery trips can be confusing. This checklist covers simple starter foods.,Basics,eggs | milk | bread | fruit | veggies,Pantry,rice | pasta | canned beans | cereal | peanut butter
honeymoon-packing-checklist,Honeymoon Packing Checklist,travel,Packing for your honeymoon is easier with a plan. This checklist covers romantic getaway essentials.,Clothing,swimwear | dinner outfits | comfortable shoes | pajamas,Travel Items,passport | camera | travel adapters | sunscreen
international-travel-checklist,International Travel Preparation Checklist,travel,International trips require extra planning. This checklist helps you prepare the essentials.,Documents,passport | visa | travel insurance | copies of documents,Travel Prep,currency exchange | adapters | emergency contacts
long-flight-checklist,Long Flight Comfort Checklist,travel,Long flights are easier with preparation. This checklist covers comfort essentials.,Comfort Items,neck pillow | eye mask | headphones | blanket,Travel Items,water bottle | snacks | entertainment
airport-security-checklist,Airport Security Checklist,travel,Getting through airport security quickly is easier when prepared.,Before Security,remove liquids | empty pockets | boarding pass ready,Carry On Rules,3-1-1 liquids | electronics accessible
family-road-trip-checklist,Family Road Trip Checklist,travel,Traveling with family requires planning. This checklist covers road trip essentials.,Car Essentials,navigation | phone chargers | emergency kit,Family Items,snacks | games | pillows
national-park-hiking-checklist,National Park Hiking Checklist,travel,Hiking in national parks requires preparation for safety.,Hiking Gear,backpack | water | map | sunscreen,Safety Items,first aid kit | whistle | flashlight
travel-document-checklist,Travel Documents Checklist,travel,Travel documentation is essential for international trips.,Documents,passport | ID | tickets | hotel confirmations,Backups,printed copies | cloud backups
minimalist-packing-checklist,Minimalist Packing Checklist,travel,Minimalist packing helps reduce luggage stress.,Clothing Basics,neutral shirts | versatile pants | underwear | socks,Travel Items,compact toiletries | lightweight shoes
campfire-cooking-checklist,Campfire Cooking Checklist,travel,Cooking outdoors requires simple preparation.,Cooking Gear,camp stove | lighter | cookware | utensils,Food Items,marshmallows | hot dogs | snacks
glamping-checklist,Glamping Packing Checklist,travel,Glamping combines camping with comfort. This checklist helps you pack smart.,Comfort Items,blankets | pillows | lanterns,Camping Gear,tent | cooler | chairs
spring-cleaning-checklist,Spring Cleaning Checklist,home,Spring cleaning refreshes your home. This checklist helps organize the process.,Cleaning Tasks,clean windows | mop floors | dust furniture,Organizing Tasks,donate items | organize closets
garage-cleanout-checklist,Garage Cleanout Checklist,home,A garage cleanout helps reclaim space. This checklist simplifies the process.,Sort Items,tools | old boxes | sports gear,Organize,install shelves | label bins
closet-organization-checklist,Closet Organization Checklist,home,Organizing your closet makes daily routines easier.,Sorting Steps,donate clothes | seasonal storage,Organization,hangers | storage bins
home-safety-checklist,Home Safety Checklist,home,Home safety checks help prevent accidents.,Safety Devices,smoke detectors | fire extinguisher,Safety Steps,test alarms | secure rugs
appliance-maintenance-checklist,Home Appliance Maintenance Checklist,home,Maintaining appliances improves lifespan.,Appliance Tasks,clean fridge coils | inspect washer hoses,Regular Checks,replace filters | wipe vents
pantry-cleanout-checklist,Pantry Cleanout Checklist,home,Cleaning your pantry prevents waste and clutter.,Clean Steps,remove expired items | wipe shelves,Organize,label containers | group foods
bathroom-stock-checklist,Bathroom Supply Checklist,home,Keeping bathroom supplies stocked avoids last-minute runs.,Essentials,toilet paper | soap | toothpaste,Extras,towels | cleaning spray
living-room-cleaning-checklist,Living Room Cleaning Checklist,home,A clean living room improves comfort and appearance.,Weekly Tasks,vacuum couch | dust shelves,Monthly Tasks,wash curtains | clean rugs
home-air-filter-checklist,Air Filter Replacement Checklist,home,Replacing air filters improves air quality.,Tasks,check HVAC filter | replace if dirty,Maintenance,set replacement reminders
home-toolkit-checklist,Home Toolkit Checklist,home,A basic toolkit helps with small repairs.,Tools,hammer | screwdriver | tape measure,Extras,level | utility knife
healthy-morning-checklist,Healthy Morning Routine Checklist,health,A healthy morning routine improves productivity.,Morning Habits,drink water | stretch | breakfast,Preparation,review schedule | set goals
sleep-hygiene-checklist,Sleep Hygiene Checklist,health,Better sleep improves overall health.,Evening Habits,avoid screens | dim lights,Comfort Setup,comfortable bedding | cool room
doctor-visit-checklist,Doctor Visit Checklist,health,Doctor appointments are more productive when prepared.,Bring With You,insurance card | medication list,Questions,symptoms | concerns
annual-physical-checklist,Annual Physical Checklist,health,Annual physical exams help maintain health.,Preparation Steps,list medications | review symptoms,Bring Items,ID | insurance card
mental-health-checklist,Mental Health Self Care Checklist,health,Mental health routines support emotional wellbeing.,Daily Habits,exercise | journaling | breaks,Support,therapy | support group
hydration-checklist,Daily Hydration Checklist,health,Proper hydration improves energy and focus.,Daily Goals,drink water regularly,Tracking,water bottle | hydration reminders
healthy-eating-checklist,Healthy Eating Checklist,health,Healthy eating habits improve wellbeing.,Food Choices,vegetables | fruits | lean protein,Habits,meal prep | portion control
gym-starting-checklist,Starting the Gym Checklist,fitness,Starting the gym is easier when prepared.,Gym Gear,shoes | water bottle | towel,Planning,set workout schedule
home-workout-checklist,Home Workout Checklist,fitness,Home workouts require basic preparation.,Equipment,yoga mat | resistance bands,Workout Plan,warmup | cool down
stretching-routine-checklist,Daily Stretching Routine Checklist,fitness,Stretching helps prevent injury.,Stretch Areas,hamstrings | shoulders,Habits,stretch morning | stretch after workout
weight-loss-checklist,Weight Loss Planning Checklist,health,Weight loss requires a clear plan.,Preparation,set goals | track calories,Habits,exercise regularly
budget-review-checklist,Budget Review Checklist,finance,Reviewing your budget helps control spending.,Income Tracking,salary | side income,Expense Review,rent | groceries
bill-paying-checklist,Monthly Bill Paying Checklist,finance,Paying bills on time prevents late fees.,Bills,rent | utilities | phone,Tracking,calendar reminders
emergency-fund-checklist,Emergency Fund Checklist,finance,Emergency funds help handle unexpected costs.,Savings Goals,3 months expenses,Steps,automatic savings
retirement-planning-checklist,Retirement Planning Checklist,finance,Planning for retirement helps long-term security.,Planning Steps,set retirement goals,Investing,401k | IRA
tax-document-checklist,Tax Document Checklist,finance,Tax filing is easier when documents are ready.,Documents,W2 | 1099 | receipts,Preparation,organize deductions
holiday-shopping-checklist,Holiday Shopping Checklist,events,Holiday shopping is easier with planning.,Gift Planning,list recipients | set budget,Shopping Steps,buy gifts | wrap presents
christmas-decorating-checklist,Christmas Decorating Checklist,events,Holiday decorating becomes easier with a plan.,Decorations,tree | lights | ornaments,Extras,garlands | wreaths
thanksgiving-prep-checklist,Thanksgiving Prep Checklist,events,Thanksgiving preparation helps avoid stress.,Food Prep,thaw turkey | prep ingredients,Table Setup,plates | decorations
new-year-goals-checklist,New Year Goals Checklist,productivity,New year goals help guide progress.,Planning Steps,set goals | write plan,Tracking,review monthly
goal-review-checklist,Goal Review Checklist,productivity,Reviewing goals helps track progress.,Review Steps,check milestones,Adjustments,update goals
daily-planner-checklist,Daily Planner Checklist,productivity,Daily planning improves productivity.,Morning Planning,set priorities,End Of Day,review tasks
focus-work-checklist,Deep Work Checklist,productivity,Deep work helps improve concentration.,Preparation,clear desk | disable notifications,Focus Tools,timer | task list
weekly-review-checklist,Weekly Review Checklist,productivity,Weekly reviews help improve planning.,Review Tasks,check completed tasks,Planning,set next week goals
digital-declutter-checklist,Digital Declutter Checklist,productivity,Digital decluttering improves productivity.,Cleanup Steps,delete old files,Organize,create folders
social-media-cleanup-checklist,Social Media Cleanup Checklist,productivity,Social media cleanup improves privacy.,Cleanup Steps,remove old posts,Privacy,review settings
phone-backup-checklist,Phone Backup Checklist,productivity,Backing up your phone prevents data loss.,Backup Options,iCloud | computer backup,Checks,verify backup
email-security-checklist,Email Security Checklist,productivity,Email security protects personal information.,Security Steps,enable 2FA,Habits,avoid suspicious links
password-update-checklist,Password Update Checklist,productivity,Regular password updates improve security.,Steps,change weak passwords,Tools,password manager
winter-car-prep-checklist,Winter Car Preparation Checklist,car,Preparing your car for winter prevents problems.,Vehicle Prep,check tires | antifreeze,Emergency Kit,blanket | flashlight
summer-car-prep-checklist,Summer Car Preparation Checklist,car,Summer driving requires preparation.,Maintenance,check AC | inspect coolant,Safety Items,water | emergency kit
